{
  "pass": 3,
  "date": "2026-07-16",
  "auditor": "Claude Fable 5 + Opus remediation subagent, two-lens audit (runtime/cli + docs/ci/release)",
  "scope": "Final audit-and-improvement pass over ai-agent-notifier: two verified runtime bugs, honesty of the user-facing README, real install bootstrappers, doctor --deep candor, CI double-run economics, small CLI/runtime correctness fixes, and the missing npm release pipeline. Reinstates the docs/audits/ convention that lapsed while demand passes 3-5 (PRs #5-#8) shipped without records.",
  "verification_summary": {
    "checks_passed": [
      "npm test — full unit + integration suite green locally on Windows (308 tests, 300 pass, 8 platform-skipped, 0 fail), including all new regression tests",
      "linux buildNotifySendArgs: options precede the `--` guard; a leading-dash message lands after `--` (tests/platforms.test.mjs)",
      "sendNtfy resolves false (never throws) on a scheme-less server typo (tests/ntfy-send.test.mjs)",
      "config-loader rejects a control-char (newline) source label and non-string label/icon, keeps clean custom values (tests/config-loader-validation.test.mjs)",
      "cli test <unknown-channel> exits 1 naming the valid set (tests/cli-test.test.mjs)",
      "doctor --deep on a non-darwin platform emits an explicit 'not available' info line (tests/doctor.test.mjs)",
      "isNewer semver gate: true only when strictly newer; 1.0.6 vs local 1.2.1 stays quiet (tests/update-check.test.mjs)",
      "npm version 1.2.1 --no-git-tag-version synced package.json + plugin.json + marketplace.json to 1.2.1 with no tag created"
    ],
    "checks_failed": [],
    "blocked": [
      "npm publish of v1.2.1 — requires the maintainer to add the NPM_TOKEN repo secret and push a v1.2.1 tag; CI must never publish or tag itself (release.yml is the rail, deliberately un-triggered)",
      "Real WSL toast-to-Windows-host delivery — not provable on a hosted GitHub runner (cannot host a WSL guest and an interactive Windows desktop together); documented as a proof boundary instead",
      "Linux doctor --deep daemon read-back — deferred follow-up; needs a notification-daemon history probe not built this pass"
    ]
  },
  "findings": [
    {
      "id": "RT-16",
      "title": "Linux notify-send called with positionals before the `--` end-of-options guard",
      "severity": "medium",
      "area": "toast-delivery",
      "evidence": "src/platforms/linux.mjs:27-31 — args were [title, message, '--urgency', level] with no `--`. GLib GOption parses any pre-`--` arg starting with '-' as an unknown option, so a rich-content message like '- Fixed the bug' makes notify-send exit non-zero and the toast silently never fires.",
      "why_it_matters": "Claude Code rich content puts the assistant's own text into the body; a dash-leading line is plausible and would silently drop the notification.",
      "confidence": "high",
      "status": "fixed",
      "resolution": "Extracted exported buildNotifySendArgs(notification, iconPath): ['--urgency', level, ...(icon?['--icon',icon]:[]), '--', title, message] — all options first, then `--`, then positionals. URGENCY_MAP/priority behavior unchanged.",
      "verification": "tests/platforms.test.mjs asserts arg order and that a leading-dash message lands after `--`."
    },
    {
      "id": "RT-17",
      "title": "sendNtfy `new URL()` unguarded — violates the module's resolve-false/never-throw contract",
      "severity": "medium",
      "area": "error-visibility",
      "evidence": "src/ntfy.mjs:31 — `const parsed = new URL(url)` was unguarded, unlike webhook.mjs:63-70 and sentry.mjs:75. A server typo with no scheme ('ntfy.sh') throws 'Invalid URL', crashing `aan test ntfy` with a raw stack instead of a clean false.",
      "why_it_matters": "The channel modules promise never to throw so a bad config can't take down the hook or the CLI; ntfy was the one that could.",
      "confidence": "high",
      "status": "fixed",
      "resolution": "Wrapped `new URL(url)` in try/catch → logHookError + resolve(false) naming the bad server (not the topic). Also wrapped transport.request setup in try/catch to mirror webhook.mjs's guard against synchronous throws on non-http(s) protocols/invalid headers.",
      "verification": "tests/ntfy-send.test.mjs: a scheme-less server yields false with no throw."
    },
    {
      "id": "MD-16",
      "title": "README standalone install one-liners point at nonexistent files",
      "severity": "high",
      "area": "install-honesty",
      "evidence": "README.md:134 (setup/install.ps1) and :139 (setup/install.sh) were advertised as curl|iex bootstrappers, but setup/ contained only patch-config.mjs — both URLs 404'd.",
      "why_it_matters": "A trust-sensitive install path people are told to pipe into a shell must exist and work; a 404 (or worse, a silent no-op) is a broken first impression.",
      "confidence": "high",
      "status": "fixed",
      "resolution": "Created setup/install.sh (set -euo pipefail, fails loudly) and setup/install.ps1 ($ErrorActionPreference='Stop'): both verify Node>=18 + npm with an actionable per-OS hint, then exec `npx --yes ai-agent-notifier@latest setup` forwarding args. setup/ is already in package.json files[].",
      "verification": "Files created and readable; scripts are thin/no-network until the npx handoff. Piped-shell end-to-end run is a maintainer step after publish."
    },
    {
      "id": "MD-17",
      "title": "README claims a macOS terminal-notifier fallback that does not exist in code",
      "severity": "medium",
      "area": "test-honesty",
      "evidence": "README.md:307 — 'Falls back to terminal-notifier for richer features if available'. grep for terminal-notifier across src/ and cli/ returns nothing; macOS uses osascript only.",
      "why_it_matters": "The repo's extreme-honesty culture requires README claims to match code exactly.",
      "confidence": "high",
      "status": "fixed",
      "resolution": "Deleted the claim (did not implement terminal-notifier)."
    },
    {
      "id": "MD-18",
      "title": "WSL over-claim: real cross-boundary toast delivery is asserted but never proven",
      "severity": "low",
      "area": "test-honesty",
      "evidence": "README.md:51 ('real Windows toast notifications from inside WSL') and :314-319. Only detection + interop invocation are tested (tests/platforms-wsl.test.mjs, fully deps-injected); no CI proves a toast reaches the Windows host.",
      "why_it_matters": "Matches how the repo already scopes Codex exec vs the TUI approval loop — claims must stop at what CI proves.",
      "confidence": "high",
      "status": "fixed",
      "resolution": "Softened the feature bullet and Platform Details WSL section to 'routed to Windows over PowerShell interop' and added an explicit proof-boundary note in both the WSL section and the Testing footnotes explaining WSL has no table row on purpose."
    },
    {
      "id": "CL-19",
      "title": "doctor --deep silently no-ops on linux/win32",
      "severity": "low",
      "area": "cli-candor",
      "evidence": "cli/doctor-checks.mjs — the `deep` flag is only consumed by the darwin toastAuthCheck; on other platforms it was accepted and ignored with no output.",
      "why_it_matters": "A flag that silently does nothing misleads the user into thinking a deep verification ran.",
      "confidence": "high",
      "status": "fixed",
      "resolution": "runChecks now pushes an explicit info-status row 'deep verification not available on <platform> (static checks only)' when --deep is passed on a platform with no deep probe; doctor.mjs ICON map gained an 'info' glyph; --json stays machine-parseable (new id 'deep-probe').",
      "verification": "tests/doctor.test.mjs asserts the deep-probe info row on non-darwin."
    },
    {
      "id": "CL-20",
      "title": "`aan test <unknown-channel>` prints the header and exits 0 doing nothing",
      "severity": "low",
      "area": "cli-correctness",
      "evidence": "cli/test.mjs — an unrecognised channel matched none of the do* gates, so the command printed the header and exited 0, reading as a silent success.",
      "why_it_matters": "A typo'd channel should fail loudly, not look like it worked.",
      "confidence": "high",
      "status": "fixed",
      "resolution": "Added exported KNOWN_CHANNELS = [toast, ntfy, webhook, bell, both]; an unknown channel prints 'Unknown channel: X (valid: ...)' to stderr and exits 1. NOTE: the task-suggested valid set listed 'all', but the code + README:147 use 'both' (no-arg = every channel); recorded the honest set that matches the code.",
      "verification": "tests/cli-test.test.mjs asserts exit 1 + message; KNOWN_CHANNELS matches the documented set."
    },
    {
      "id": "RT-18",
      "title": "Hook stdout.write followed by immediate process.exit can drop the response",
      "severity": "low",
      "area": "runtime-correctness",
      "evidence": "src/notify.mjs:201-202 — process.stdout.write(responseBody); process.exit(0). On a back-pressured stdout the buffered write can be lost before exit (notably the claude terminalSequence bell payload).",
      "confidence": "medium",
      "status": "fixed",
      "resolution": "process.stdout.write(responseBody, () => process.exit(0)) — exit only after the write drains."
    },
    {
      "id": "RT-19",
      "title": "config `sources` block had no schema check — label/icon unvalidated",
      "severity": "medium",
      "area": "config-schema",
      "evidence": "src/config-loader.mjs — 'sources' was in knownTop but had no checkBlock; a newline in sources.<tool>.label flows to notification.title and later corrupts the ntfy Title HTTP header at send time.",
      "why_it_matters": "A control char in label/icon is a header-injection / send-failure vector; every other block is validated.",
      "confidence": "high",
      "status": "fixed",